<?xml version="1.0" encoding="UTF-8"?>
<inventario xmlns:xsi="http://www.w3.org/2001/XMLSchema-instance"
            xsi:noNamespaceSchemaLocation="../schemas/schema.xsd">

  <metadata>
    <titulo>Inventario Hardware - Aula 1º ASIR</titulo>
    <centro>IES Ejemplo</centro>
    <aula>Aula de Redes - 1º ASIR</aula>
    <fecha_actualizacion>2025-05-14</fecha_actualizacion>
    <responsable>Departamento de Informática</responsable>
    <version>1.0</version>
  </metadata>

  <!-- ==================== CATEGORÍA: EQUIPOS DE CÓMPUTO ==================== -->
  <categoria id="CAT-001" nombre="Equipos de Cómputo">
    <imagen>../src/imagenes/PC.jpeg</imagen>
    <producto id="PROD-001">
      <nombre>Ordenador HP EliteDesk 800 G5</nombre>
      <marca>HP</marca>
      <modelo>EliteDesk 800 G5</modelo>
      <tipo>Ordenador de Sobremesa</tipo>
      <estado>Activo</estado>
      <ubicacion>Aula 1º ASIR - Puestos de alumnos</ubicacion>
      <cantidad_total>30</cantidad_total>
      <cantidad_operativa>30</cantidad_operativa>
      <cantidad_baja>0</cantidad_baja>
      <especificaciones>
        <procesador>Intel Core i5-9500</procesador>
        <ram>8 GB DDR4</ram>
        <almacenamiento>256 GB SSD</almacenamiento>
        <sistema_operativo>Windows 10 Pro / Linux Ubuntu 22.04</sistema_operativo>
        <puertos>USB 3.0 x4, DisplayPort, VGA, RJ45</puertos>
      </especificaciones>
      <unidades>
        <unidad id="HP-PC-001" num_serie="HP800G5-001" estado="Operativo" puesto="P01"/>
        <unidad id="HP-PC-002" num_serie="HP800G5-002" estado="Operativo" puesto="P02"/>
        <unidad id="HP-PC-003" num_serie="HP800G5-003" estado="Operativo" puesto="P03"/>
        <unidad id="HP-PC-004" num_serie="HP800G5-004" estado="Operativo" puesto="P04"/>
        <unidad id="HP-PC-005" num_serie="HP800G5-005" estado="Operativo" puesto="P05"/>
        <unidad id="HP-PC-006" num_serie="HP800G5-006" estado="Operativo" puesto="P06"/>
        <unidad id="HP-PC-007" num_serie="HP800G5-007" estado="Operativo" puesto="P07"/>
        <unidad id="HP-PC-008" num_serie="HP800G5-008" estado="Operativo" puesto="P08"/>
        <unidad id="HP-PC-009" num_serie="HP800G5-009" estado="Operativo" puesto="P09"/>
        <unidad id="HP-PC-010" num_serie="HP800G5-010" estado="Operativo" puesto="P10"/>
        <unidad id="HP-PC-011" num_serie="HP800G5-011" estado="Operativo" puesto="P11"/>
        <unidad id="HP-PC-012" num_serie="HP800G5-012" estado="Operativo" puesto="P12"/>
        <unidad id="HP-PC-013" num_serie="HP800G5-013" estado="Operativo" puesto="P13"/>
        <unidad id="HP-PC-014" num_serie="HP800G5-014" estado="Operativo" puesto="P14"/>
        <unidad id="HP-PC-015" num_serie="HP800G5-015" estado="Operativo" puesto="P15"/>
        <unidad id="HP-PC-016" num_serie="HP800G5-016" estado="Operativo" puesto="P16"/>
        <unidad id="HP-PC-017" num_serie="HP800G5-017" estado="Operativo" puesto="P17"/>
        <unidad id="HP-PC-018" num_serie="HP800G5-018" estado="Operativo" puesto="P18"/>
        <unidad id="HP-PC-019" num_serie="HP800G5-019" estado="Operativo" puesto="P19"/>
        <unidad id="HP-PC-020" num_serie="HP800G5-020" estado="Operativo" puesto="P20"/>
        <unidad id="HP-PC-021" num_serie="HP800G5-021" estado="Operativo" puesto="P21"/>
        <unidad id="HP-PC-022" num_serie="HP800G5-022" estado="Operativo" puesto="P22"/>
        <unidad id="HP-PC-023" num_serie="HP800G5-023" estado="Operativo" puesto="P23"/>
        <unidad id="HP-PC-024" num_serie="HP800G5-024" estado="Operativo" puesto="P24"/>
        <unidad id="HP-PC-025" num_serie="HP800G5-025" estado="Operativo" puesto="P25"/>
        <unidad id="HP-PC-026" num_serie="HP800G5-026" estado="Operativo" puesto="P26"/>
        <unidad id="HP-PC-027" num_serie="HP800G5-027" estado="Operativo" puesto="P27"/>
        <unidad id="HP-PC-028" num_serie="HP800G5-028" estado="Operativo" puesto="P28"/>
        <unidad id="HP-PC-029" num_serie="HP800G5-029" estado="Operativo" puesto="P29"/>
        <unidad id="HP-PC-030" num_serie="HP800G5-030" estado="Operativo" puesto="P30"/>
      </unidades>
      <observaciones>Equipos principales del aula para uso diario de los alumnos</observaciones>
    </producto> 

    <producto id="PROD-002">
     
      <nombre>Ordenador HP EliteDesk 800 G5 (Repuesto)</nombre>
      <marca>HP</marca>
      <modelo>EliteDesk 800 G5</modelo>
      <tipo>Ordenador de Sobremesa - Repuesto</tipo>
      <estado>Almacenado</estado>
      <ubicacion>Almacén Departamento Informática</ubicacion>
      <cantidad_total>15</cantidad_total>
      <cantidad_operativa>15</cantidad_operativa>
      <cantidad_baja>0</cantidad_baja>
      <especificaciones>
        <procesador>Intel Core i5-9500</procesador>
        <ram>8 GB DDR4</ram>
        <almacenamiento>256 GB SSD</almacenamiento>
        <sistema_operativo>Sin instalar</sistema_operativo>
        <puertos>USB 3.0 x4, DisplayPort, VGA, RJ45</puertos>
      </especificaciones>
      <unidades>
        <unidad id="HP-REP-001" num_serie="HP800G5-REP-001" estado="Almacenado" puesto="ALMACEN"/>
        <unidad id="HP-REP-002" num_serie="HP800G5-REP-002" estado="Almacenado" puesto="ALMACEN"/>
        <unidad id="HP-REP-003" num_serie="HP800G5-REP-003" estado="Almacenado" puesto="ALMACEN"/>
        <unidad id="HP-REP-004" num_serie="HP800G5-REP-004" estado="Almacenado" puesto="ALMACEN"/>
        <unidad id="HP-REP-005" num_serie="HP800G5-REP-005" estado="Almacenado" puesto="ALMACEN"/>
        <unidad id="HP-REP-006" num_serie="HP800G5-REP-006" estado="Almacenado" puesto="ALMACEN"/>
        <unidad id="HP-REP-007" num_serie="HP800G5-REP-007" estado="Almacenado" puesto="ALMACEN"/>
        <unidad id="HP-REP-008" num_serie="HP800G5-REP-008" estado="Almacenado" puesto="ALMACEN"/>
        <unidad id="HP-REP-009" num_serie="HP800G5-REP-009" estado="Almacenado" puesto="ALMACEN"/>
        <unidad id="HP-REP-010" num_serie="HP800G5-REP-010" estado="Almacenado" puesto="ALMACEN"/>
        <unidad id="HP-REP-011" num_serie="HP800G5-REP-011" estado="Almacenado" puesto="ALMACEN"/>
        <unidad id="HP-REP-012" num_serie="HP800G5-REP-012" estado="Almacenado" puesto="ALMACEN"/>
        <unidad id="HP-REP-013" num_serie="HP800G5-REP-013" estado="Almacenado" puesto="ALMACEN"/>
        <unidad id="HP-REP-014" num_serie="HP800G5-REP-014" estado="Almacenado" puesto="ALMACEN"/>
        <unidad id="HP-REP-015" num_serie="HP800G5-REP-015" estado="Almacenado" puesto="ALMACEN"/>
      </unidades>
      <observaciones>Unidades de reserva para sustitución inmediata en caso de avería</observaciones>
    </producto>

  </categoria>

  <!-- ==================== CATEGORÍA: PERIFÉRICOS ==================== -->
  <categoria id="CAT-002" nombre="Periféricos">
    <imagen>../src/imagenes/TECLADO.jpeg</imagen>
    <producto id="PROD-003">
      <nombre>Teclado HP Smart Card CCID</nombre>
      <marca>HP</marca>
      <modelo>Smart Card CCID Keyboard</modelo>
      <tipo>Teclado con Lector de Tarjeta Inteligente</tipo>
      <estado>Activo</estado>
      <ubicacion>Aula 1º ASIR - Puestos especiales</ubicacion>
      <cantidad_total>5</cantidad_total>
      <cantidad_operativa>5</cantidad_operativa>
      <cantidad_baja>0</cantidad_baja>
      <especificaciones>
        <conexion>USB 2.0</conexion>
        <lector_tarjeta>CCID ISO 7816</lector_tarjeta>
        <idioma>Español (ES)</idioma>
        <retroiluminacion>No</retroiluminacion>
        <cable>1.8 m</cable>
      </especificaciones>
      <unidades>
        <unidad id="KB-SC-001" num_serie="HPSC-KB-001" estado="Operativo" puesto="P-ESPECIAL-01"/>
        <unidad id="KB-SC-002" num_serie="HPSC-KB-002" estado="Operativo" puesto="P-ESPECIAL-02"/>
        <unidad id="KB-SC-003" num_serie="HPSC-KB-003" estado="Operativo" puesto="P-ESPECIAL-03"/>
        <unidad id="KB-SC-004" num_serie="HPSC-KB-004" estado="Operativo" puesto="P-ESPECIAL-04"/>
        <unidad id="KB-SC-005" num_serie="HPSC-KB-005" estado="Operativo" puesto="P-ESPECIAL-05"/>
      </unidades>
      <observaciones>Teclados con lector de tarjeta inteligente para prácticas de seguridad</observaciones>
    </producto>

    <producto id="PROD-004">
      
      <nombre>Monitor HP EliteDisplay E243</nombre>
      <marca>HP</marca>
      <modelo>EliteDisplay E243</modelo>
      <tipo>Monitor IPS Full HD</tipo>
      <estado>Activo</estado>
      <ubicacion>Aula 1º ASIR - Puestos de alumnos y almacén</ubicacion>
      <cantidad_total>37</cantidad_total>
      <cantidad_operativa>35</cantidad_operativa>
      <cantidad_baja>2</cantidad_baja>
      <especificaciones>
        <pantalla>23.8 pulgadas IPS</pantalla>
        <resolucion>1920x1080 Full HD</resolucion>
        <tiempo_respuesta>5 ms</tiempo_respuesta>
        <brillo>250 cd/m²</brillo>
        <conexiones>DisplayPort, HDMI, VGA, USB Hub</conexiones>
        <ajuste>Altura, Inclinación, Pivote</ajuste>
      </especificaciones>
      <unidades>
        <unidad id="MON-001" num_serie="HPED-E243-001" estado="Operativo" puesto="P01"/>
        <unidad id="MON-002" num_serie="HPED-E243-002" estado="Operativo" puesto="P02"/>
        <unidad id="MON-003" num_serie="HPED-E243-003" estado="Operativo" puesto="P03"/>
        <unidad id="MON-004" num_serie="HPED-E243-004" estado="Operativo" puesto="P04"/>
        <unidad id="MON-005" num_serie="HPED-E243-005" estado="Operativo" puesto="P05"/>
        <unidad id="MON-006" num_serie="HPED-E243-006" estado="Operativo" puesto="P06"/>
        <unidad id="MON-007" num_serie="HPED-E243-007" estado="Operativo" puesto="P07"/>
        <unidad id="MON-008" num_serie="HPED-E243-008" estado="Operativo" puesto="P08"/>
        <unidad id="MON-009" num_serie="HPED-E243-009" estado="Operativo" puesto="P09"/>
        <unidad id="MON-010" num_serie="HPED-E243-010" estado="Operativo" puesto="P10"/>
        <unidad id="MON-011" num_serie="HPED-E243-011" estado="Operativo" puesto="P11"/>